,Raw,req-label,req,chunk-count,chunks-in-req,keyword-count,keywords-in-req
0,"PE:The system shall refresh the display every 60 seconds.
",PE,The system shall refresh the display every 60 seconds.,2,"system, display",7,"refresh, second, every, system, shall, display, 60"
1,"LF:The application shall match the color of the schema set forth by Department of Homeland Security
",LF,The application shall match the color of the schema set forth by Department of Homeland Security,5,"application, color, schema, set forth by department, of homeland security",10,"match, schema, application, set, homeland, security, department, shall, color, forth"
2,"US: If projected, the data must be readable.  On a 10x10 projection screen  90% of viewers must be able to read Event / Activity data from a viewing distance of 30
",US," If projected, the data must be readable.  On a 10x10 projection screen  90% of viewers must be able to read Event / Activity data from a viewing distance of 30",5,"10x10 projection screen, 90 %, read event, activity, viewing distance",16,"able, project, viewer, activity, screen, 90, readable, projection, data, must, distance, read, view, event, 10x10, 30"
3,"A: The product shall be available during normal business hours. As long as the user has access to the client PC  the system will be available 99% of the time during the first six months of operation.
",A, The product shall be available during normal business hours. As long as the user has access to the client PC  the system will be available 99% of the time during the first six months of operation.,9,"product, business, user, has access, client pc, system, 99 %, time, of operation",18,"product, 99, month, system, shall, long, normal, client, pc, six, access, operation, available, first, hour, time, business, user"
4,"US: If projected  the data must be understandable. On a 10x10 projection screen  90% of viewers must be able to determine that Events or Activities are occuring in current time from a viewing distance of 100
",US, If projected  the data must be understandable. On a 10x10 projection screen  90% of viewers must be able to determine that Events or Activities are occuring in current time from a viewing distance of 100,5,"data, 10x10 projection screen, 90 %, time, viewing distance",19,"viewer, 90, projection, distance, view, determine, occur, project, screen, data, must, current, event, able, understandable, 10x10, 100, time, activity"
5,"SE:The product shall ensure that it can only be accessed by authorized users.  The product will be able to distinguish between authorized and unauthorized users in all access attempts
",SE,The product shall ensure that it can only be accessed by authorized users.  The product will be able to distinguish between authorized and unauthorized users in all access attempts,3,"product, product, access",11,"able, product, attempt, distinguish, ensure, authorized, shall, unauthorized, user, authorize, access"
6,"US:The product shall be intuitive and self-explanatory.  :  90% of new users shall be able to start the display of Events or Activities within 90 minutes of using the product.
",US,The product shall be intuitive and self-explanatory.  :  90% of new users shall be able to start the display of Events or Activities within 90 minutes of using the product.,4,"product, 90 %, display, product",15,"able, within, product, new, 90, start, intuitive, minute, display, shall, event, use, user, self-explanatory, activity"
7,"PE:The product shall respond fast to keep up-to-date data in the display.
",PE,The product shall respond fast to keep up-to-date data in the display.,2,"product, display",8,"product, keep, up-to-date, data, shall, fast, display, respond"
8,"F:The system shall have a MDI form that allows for the viewing of the graph and the data table.
",F,The system shall have a MDI form that allows for the viewing of the graph and the data table.,5,"system, form, viewing, graph, table",9,"viewing, graph, table, data, allow, system, mdi, shall, form"
9,"F:The system shall display Events in a vertical table by time.
",F,The system shall display Events in a vertical table by time.,2,"system, table by time",7,"vertical, time, system, shall, event, display, table"
10,"F:The system shall display the Events in a graph by time.
",F,The system shall display the Events in a graph by time.,2,"system, graph by time",6,"graph, time, system, shall, event, display"
11,"L:All business rules specified in the Disputes System shall be in compliance to the guidelines of Regulation E and Regulation Z.
",L,All business rules specified in the Disputes System shall be in compliance to the guidelines of Regulation E and Regulation Z.,5,"business, system, be in compliance, of regulation e, regulation z",11,"e, dispute, compliance, guideline, system, specify, z, shall, business, regulation, rule"
12,"L:The Disputes application must maintain a detailed history of every action that a user takes on a dispute case.  This ensures a complete audit trail if questions arise later on with regard to a particular dispute case.
",L,The Disputes application must maintain a detailed history of every action that a user takes on a dispute case.  This ensures a complete audit trail if questions arise later on with regard to a particular dispute case.,8,"application, history, action, user, dispute case, audit trail, later on with regard, dispute case",20,"action, every, audit, ensure, arise, detailed, must, take, maintain, regard, case, trail, application, particular, question, dispute, history, complete, user, later"
13,"L:All actions that modify an existing dispute case must be recorded in the case history.
",L,All actions that modify an existing dispute case must be recorded in the case history.,2,"existing dispute case, case history",8,"modify, record, dispute, action, must, exist, history, case"
14,"F:The Disputes System must be accessible by both internal and external users.
",F,The Disputes System must be accessible by both internal and external users.,1,system,7,"accessible, dispute, must, system, external, user, internal"
15,"F:The Disputes System must prevent users from accessing any dispute cases that do not belong to their cardholder base.
",F,The Disputes System must prevent users from accessing any dispute cases that do not belong to their cardholder base.,3,"system, dispute, cardholder base",10,"base, dispute, must, cardholder, system, belong, user, prevent, access, case"
16,"F:The Disputes System will facilitate direct data entry of a dispute case via a user interface that supports real time responses to the users.
",F,The Disputes System will facilitate direct data entry of a dispute case via a user interface that supports real time responses to the users.,5,"system, entry, dispute case, interface, time",14,"support, real, direct, dispute, interface, data, response, entry, facilitate, time, system, via, user, case"
17,"F:The Disputes System must provide different levels of access with regard to disputes case initiation and follow-up actions.
",F,The Disputes System must provide different levels of access with regard to disputes case initiation and follow-up actions.,4,"system, of access, with regard, case initiation",12,"provide, regard, dispute, action, must, follow-up, system, initiation, different, level, access, case"
18,"F:The Disputes System shall provide view access capability for authorized users of the application.
",F,The Disputes System shall provide view access capability for authorized users of the application.,3,"system, provide view access capability, application",10,"provide, application, dispute, view, system, authorized, capability, shall, user, access"
19,"F:The Disputes System shall provide update access capability for authorized users of the application.
",F,The Disputes System shall provide update access capability for authorized users of the application.,3,"system, access capability, application",10,"provide, application, dispute, system, authorized, capability, shall, user, update, access"
20,"F:The Disputes System must allow the users to select disputable transactions (based on the age of the transaction) from a user interface and initiate a dispute (ticket retrieval request or chargeback notification) on the selected transaction.
",F,The Disputes System must allow the users to select disputable transactions (based on the age of the transaction) from a user interface and initiate a dispute (ticket retrieval request or chargeback notification) on the selected transaction.,8,"system, age, transaction, interface, dispute, ticket retrieval request, chargeback notification, selected transaction",17,"disputable, retrieval, select, base, dispute, interface, ticket, must, chargeback, allow, system, age, initiate, notification, user, transaction, request"
21,"F:The Disputes System must provide the user the ability to initiate a single dispute case on multiple transactions that belong to a single merchant.
",F,The Disputes System must provide the user the ability to initiate a single dispute case on multiple transactions that belong to a single merchant.,5,"system, user, ability, dispute case, merchant",13,"provide, single, merchant, dispute, multiple, must, system, initiate, belong, user, transaction, ability, case"
22,"F:The Disputes System will provide the user the ability to create or initiate a ticket retrieval request.   As part of ticket retrieval creation process the system must prompt the user to enter all the required information to create the ticket retrieval request.  The ticket retrieval request is a document that is sent to merchant inquiring the validity of a transaction.
",F,The Disputes System will provide the user the ability to create or initiate a ticket retrieval request.   As part of ticket retrieval creation process the system must prompt the user to enter all the required information to create the ticket retrieval request.  The ticket retrieval request is a document that is sent to merchant inquiring the validity of a transaction.,15,"system, user, ability, ticket retrieval request, as part, of ticket, creation process, system, user, information, ticket retrieval request, ticket retrieval request, document, validity, transaction",24,"document, information, system, request, retrieval, transaction, must, enter, send, initiate, ability, process, inquire, creation, prompt, provide, required, merchant, dispute, ticket, validity, user, part, create"
23,"F:The Disputes System must allow the user to create three unique types of ticket retrieval requests.  The three types of ticket retrieval requests are (1) Request for original receipt (2) Request for a copy of the receipt or (3) Request for a portfolio. A portfolio consists of documentation that would provide proof of a purchase such as the documentation that is received from a car rental agency that is more than a sales receipt.
",F,The Disputes System must allow the user to create three unique types of ticket retrieval requests.  The three types of ticket retrieval requests are (1) Request for original receipt (2) Request for a copy of the receipt or (3) Request for a portfolio. A portfolio consists of documentation that would provide proof of a purchase such as the documentation that is received from a car rental agency that is more than a sales receipt.,19,"system, user, of ticket retrieval, of ticket retrieval, request, receipt, request, copy, receipt, request, portfolio, portfolio, consists of documentation, provide proof, purchase, documentation, car, agency, receipt",30,"documentation, receive, rental, type, consist, agency, system, 1, unique, request, retrieval, 2, three, must, would, allow, sale, original, car, copy, purchase, provide, dispute, ticket, receipt, 3, portfolio, proof, user, create"
24,"F:The Disputes System must prevent external users from requesting original receipts. Requests for original receipts are restricted to internal users.
",F,The Disputes System must prevent external users from requesting original receipts. Requests for original receipts are restricted to internal users.,1,system,11,"restrict, original, dispute, receipt, must, system, external, user, prevent, request, internal"
25,"F: The Disputes System must provide a confirmation to the user upon the creation of ticket retrieval request that contains the following information; the dispute case number  the type of retrieval requested (copy  original or portfolio)  and the date that the merchant response is due.
",F, The Disputes System must provide a confirmation to the user upon the creation of ticket retrieval request that contains the following information; the dispute case number  the type of retrieval requested (copy  original or portfolio)  and the date that the merchant response is due.,11,"system, confirmation, user, creation of ticket retrieval request, information, dispute case number, type of retrieval, original, portfolio, date, merchant response",24,"type, information, system, request, number, retrieval, must, due, confirmation, following, contain, case, original, response, copy, creation, provide, merchant, dispute, ticket, date, portfolio, user, upon"
26,"F:The Disputes System shall allow the user to create or initiate a chargeback request.  The system must prompt the user to enter the required information to initiate a chargeback request. The chargeback request results in a printed chargeback notification that is sent to merchant indicating that their account will be charged back if no proof is provided that the disputed transaction is valid.
",F,The Disputes System shall allow the user to create or initiate a chargeback request.  The system must prompt the user to enter the required information to initiate a chargeback request. The chargeback request results in a printed chargeback notification that is sent to merchant indicating that their account will be charged back if no proof is provided that the disputed transaction is valid.,12,"system, user, chargeback request, system, user, information, chargeback request, chargeback request, chargeback notification, account, proof, transaction",28,"account, result, information, system, shall, request, printed, must, allow, enter, send, initiate, chargeback, charge, indicate, notification, back, prompt, provide, required, merchant, valid, dispute, proof, disputed, user, transaction, create"
27,"F: The Disputes System must provide a confirmation to the user upon the creation of a chargeback request. The confirmation must contain the following information; the dispute case number  the type of chargeback requested (pending or immediate)  and the date that the merchant response is due.
",F, The Disputes System must provide a confirmation to the user upon the creation of a chargeback request. The confirmation must contain the following information; the dispute case number  the type of chargeback requested (pending or immediate)  and the date that the merchant response is due.,11,"system, confirmation, user, creation, chargeback request, confirmation, information, dispute case number, type of chargeback, date, merchant response",22,"type, immediate, information, system, pending, request, number, must, due, confirmation, following, chargeback, contain, case, response, creation, provide, merchant, dispute, date, user, upon"
28,"F:The Disputes System shall prevent the creation of duplicate dispute requests 100% of the time.
",F,The Disputes System shall prevent the creation of duplicate dispute requests 100% of the time.,5,"system, creation, dispute, requests 100 %, time",9,"100, dispute, time, system, shall, creation, prevent, duplicate, request"
29,"F: The Disputes System shall accurately provide a list of possible reason codes for a given transaction.  The list of possible reason codes must be derived based on the type of transaction and the industry that the merchant belongs to  according to the business rules defined for the Disputes System.
",F, The Disputes System shall accurately provide a list of possible reason codes for a given transaction.  The list of possible reason codes must be derived based on the type of transaction and the industry that the merchant belongs to  according to the business rules defined for the Disputes System.,11,"system, list, reason, given transaction, list, reason, type of transaction, industry, merchant, business, system",22,"type, accurately, system, shall, give, base, must, code, define, belong, reason, rule, provide, list, merchant, industry, dispute, derive, possible, business, accord, transaction"
30,"F:The Disputes System must provide the ability to view existing dispute cases.
",F,The Disputes System must provide the ability to view existing dispute cases.,3,"system, ability, view existing dispute",8,"provide, dispute, must, view, system, exist, ability, case"
31,"F: The Disputes System must provide Search functionality.  The search method must include the ability to search by (1) the dispute case number  (2) the merchant account number  (3) the cardmember account number and (4) the issuer number.  In addition to the above criteria  the search functionality must further allow the user to limit the results of the search by a date range  the type of dispute (ticket retrieval request or chargeback notification)  the case status (open  closed or all) and the dispute reason code.
",F, The Disputes System must provide Search functionality.  The search method must include the ability to search by (1) the dispute case number  (2) the merchant account number  (3) the cardmember account number and (4) the issuer number.  In addition to the above criteria  the search functionality must further allow the user to limit the results of the search by a date range  the type of dispute (ticket retrieval request or chargeback notification)  the case status (open  closed or all) and the dispute reason code.,18,"system, provide search functionality, search method, ability, dispute case number, merchant account number, cardmember account number, issuer number, in addition, search functionality, user, search, date range, type of dispute, ticket retrieval request, chargeback notification, case status, dispute reason code",39,"cardmember, account, result, type, close, criterion, limit, system, 1, method, request, number, 2, retrieval, far, search, functionality, must, 4, allow, range, code, chargeback, ability, case, open, addition, issuer, notification, include, status, reason, provide, merchant, dispute, date, ticket, 3, user"
32,"F:A list of all disputes cases that meet the entered search criteria must be provided to the user.  The list of cases must differentiate the type and/or status of the case by color -coding the line item in the list.  For example all open cases will be yellow and all closed cases will be gray.
",F,A list of all disputes cases that meet the entered search criteria must be provided to the user.  The list of cases must differentiate the type and/or status of the case by color -coding the line item in the list.  For example all open cases will be yellow and all closed cases will be gray.,9,"list, entered search, user, list, type and/or status, case by color, line item, list, for example",23,"differentiate, meet, example, type, criterion, line, yellow, search, closed, must, enter, case, open, and/or, item, color, -coding, status, provide, list, dispute, gray, user"
33,"F:The Disputes System shall provide the users the ability to view the history of all activities that have occurred on the dispute case.
",F,The Disputes System shall provide the users the ability to view the history of all activities that have occurred on the dispute case.,4,"system, ability, history, dispute case",11,"provide, occur, dispute, view, system, history, shall, user, activity, ability, case"
34,"F:The Dispute System shall provide the users with the ability to follow up on a dispute case via follow-up actions.  The list of available follow up actions for a given dispute case must be filtered by the status of the case and the access level of the user.
",F,The Dispute System shall provide the users with the ability to follow up on a dispute case via follow-up actions.  The list of available follow up actions for a given dispute case must be filtered by the status of the case and the access level of the user.,9,"dispute system, ability, dispute case, list, given dispute case, status, case, access level, user",19,"action, system, shall, filter, via, give, must, follow-up, level, access, ability, case, available, status, provide, list, dispute, follow, user"
35,"F: The Disputes System shall record the name of the user and the date for any activity that creates or modifies the disputes case in the system.  A detailed history of the actions taken on the case  including the date and the user that performed the action must be maintained for auditing purposes.
",F, The Disputes System shall record the name of the user and the date for any activity that creates or modifies the disputes case in the system.  A detailed history of the actions taken on the case  including the date and the user that performed the action must be maintained for auditing purposes.,12,"system, name, user, date, activity, case, system, history, case, date, user, action",21,"purpose, action, audit, system, shall, perform, modify, record, detailed, take, must, maintain, case, name, include, dispute, date, history, user, activity, create"
36,"F: For any systematic (non-user initiated) action that occurs on a case such as the disputes aging process  a case activity will be generated.  Upon the next logon the user that initiated the dispute case must be notified that a systematic action has occurred on the dispute case.
",F, For any systematic (non-user initiated) action that occurs on a case such as the disputes aging process  a case activity will be generated.  Upon the next logon the user that initiated the dispute case must be notified that a systematic action has occurred on the dispute case.,9,"action, case, aging process, case activity, logon, user, dispute case, action, dispute case",17,"non-user, notify, process, systematic, upon, dispute, action, next, must, logon, age, generate, user, initiate, activity, occur, case"
37,"F:All letter requests must be formatted according to guidelines specified by the Print Letter Utility system.
",F,All letter requests must be formatted according to guidelines specified by the Print Letter Utility system.,2,"letter, print letter utility system",10,"utility, format, must, letter, guideline, print, specify, system, accord, request"
38,"F:Any disputes cases that have been closed for over 6 months must be purged from the online disputes database.
",F,Any disputes cases that have been closed for over 6 months must be purged from the online disputes database.,2,"online, disputes database",9,"online, dispute, month, database, must, close, purge, 6, case"
39,"O:The product must support Internet Explorer 5.5 and above.
",O,The product must support Internet Explorer 5.5 and above.,2,"product, support internet explorer",6,"internet, product, support, 5.5, explorer, must"
40,"O:The product must support Mozilla Firefox 1.0 and above.
",O,The product must support Mozilla Firefox 1.0 and above.,2,"product, support mozilla firefox",6,"support, product, 1.0, firefox, must, mozilla"
41,"O:The product shall interface with the Choice Parts System.  This provides the feed of recycled parts data.
",O,The product shall interface with the Choice Parts System.  This provides the feed of recycled parts data.,4,"product, choice, system, feed",10,"provide, product, feed, interface, choice, data, system, shall, recycled, part"
42,"O:The product shall run on the existing hardware for all environments.
",O,The product shall run on the existing hardware for all environments.,2,"product, existing hardware",6,"product, run, exist, hardware, shall, environment"
43,"O:The product shall adhere to the corporate Architecture guidelines
",O,The product shall adhere to the corporate Architecture guidelines,2,"product, architecture",6,"adhere, product, architecture, corporate, guideline, shall"
44,"LF:The product shall comply with corporate User Interface Guidelines
",LF,The product shall comply with corporate User Interface Guidelines,2,"product, interface",7,"product, corporate, interface, guideline, shall, user, comply"
45,"LF:The product shall comply with corporate color scheme
",LF,The product shall comply with corporate color scheme,2,"product, color scheme",6,"product, scheme, corporate, shall, color, comply"
46,"LF:The appearance of the product shall appear professional
",LF,The appearance of the product shall appear professional,2,"appearance, product",5,"product, professional, appear, shall, appearance"
47,"US:The product shall be easy to use by Adjusters and Collision Estimators.  95% of Adjusters and Collision Estimators shall find the product easy to use.
",US,The product shall be easy to use by Adjusters and Collision Estimators.  95% of Adjusters and Collision Estimators shall find the product easy to use.,5,"product, collision, 95 %, collision, product easy",9,"product, collision, 95, shall, use, easy, estimator, find, adjuster"
48,"US:The product shall increase productivity of Collision Estimators. 80% of the Collision Estimators shall agree their productivity has increase within 1 month of using the product.
",US,The product shall increase productivity of Collision Estimators. 80% of the Collision Estimators shall agree their productivity has increase within 1 month of using the product.,8,"product, increase productivity of collision, 80 %, collision, productivity, has increase, 1 month, product",12,"product, collision, month, increase, productivity, shall, estimator, agree, 1, use, within, 80"
