,Raw,req-label,req,chunk-count,chunks-in-req,keyword-count,keywords-in-req
269,"SE: The website shall make its user aware of its information practices before collection data from them via a Privacy Policy  accessible on all pages of the website.
",SE, The website shall make its user aware of its information practices before collection data from them via a Privacy Policy  accessible on all pages of the website.,5,"user aware, information, before collection, privacy policy, website",14,"accessible, collection, page, policy, data, make, information, privacy, practice, aware, shall, via, user, website"
270,"SE:The system shall notify customers of changes to its information policy.
",SE,The system shall notify customers of changes to its information policy.,2,"system, information policy",7,"notify, policy, information, system, customer, shall, change"
271,"SE:The system shall reveal private information only in compliance with the organization's information policy.
",SE,The system shall reveal private information only in compliance with the organization's information policy.,5,"system, information, only in compliance, organization, information policy",9,"organization, policy, compliance, information, system, shall, private, 's, reveal"
272,"SE: All customer information will be stored on a secure database  accessible only to authorized personnel.
",SE, All customer information will be stored on a secure database  accessible only to authorized personnel.,2,"customer information, secure database",8,"secure, accessible, personnel, information, customer, store, authorize, database"
273,"SE:All credit card information will be encrypted in the database.
",SE,All credit card information will be encrypted in the database.,2,"credit card information, database",5,"card, information, encrypt, credit, database"
274,"SE:The streaming server will have anti-virus software to prevent infection of malicious viruses.
",SE,The streaming server will have anti-virus software to prevent infection of malicious viruses.,3,"streaming server, software, prevent infection",8,"streaming, anti-virus, infection, software, prevent, server, malicious, virus"
275,"LF:The website should cater to all tribes in Nigeria.
",LF,The website should cater to all tribes in Nigeria.,2,"website, in nigeria",4,"cater, nigeria, tribe, website"
276,"LF:The website shall not be offensive to religious or ethnic groups.
",LF,The website shall not be offensive to religious or ethnic groups.,0,,6,"ethnic, offensive, religious, shall, group, website"
277,"LF: The website should appeal to all Africans  not only Nigerians.
",LF, The website should appeal to all Africans  not only Nigerians.,1,website,4,"nigerian, african, appeal, website"
278,"O:The website should use Flash to provide animation on the home page.
",O,The website should use Flash to provide animation on the home page.,4,"website, use flash, provide animation, home page",7,"provide, page, home, flash, use, animation, website"
279,"L:IzognMovies shall meet the licensing requirements set forth by the appropriate organizations in order to stream African movies.
",L,IzognMovies shall meet the licensing requirements set forth by the appropriate organizations in order to stream African movies.,3,"licensing, set forth, in order",13,"requirement, set, meet, organization, stream, appropriate, movie, african, order, shall, forth, izognmovies, licensing"
280,"L:The website will comply with W3C standards.
",L,The website will comply with W3C standards.,1,website,4,"w3c, standard, comply, website"
281,"L:The PHP code will comply with PEAR standards.
",L,The PHP code will comply with PEAR standards.,1,php code,5,"php, standard, code, pear, comply"
282,"F: The website will allow customers to search for movies by title  actor  or director.
",F, The website will allow customers to search for movies by title  actor  or director.,3,"website, by title actor, director",8,"title, search, movie, allow, director, customer, actor, website"
283,"F: viewing a movie details  the website will display the movies description  actor  and director entered in by the administrator.
",F, viewing a movie details  the website will display the movies description  actor  and director entered in by the administrator.,5,"movie, website, description actor, director, administrator",10,"description, administrator, detail, movie, view, director, enter, display, actor, website"
284,"F: Website shall request  and authorize credit card payment before allowing a user to stream a movie.
",F, Website shall request  and authorize credit card payment before allowing a user to stream a movie.,4,"authorize credit, payment, user, movie",11,"stream, credit, movie, card, payment, allow, shall, user, authorize, website, request"
285,"F: shall be able to stream purchased movie via Windows Media Player  for up to 2 days aftere purchase date.
",F, shall be able to stream purchased movie via Windows Media Player  for up to 2 days aftere purchase date.,3,"movie, player, aftere purchase date",14,"able, stream, 2, day, medium, date, movie, purchased, aftere, purchase, player, shall, via, window"
286,"F:Website shall allow customers to browse movies by categories entered in by izogn administrator.
",F,Website shall allow customers to browse movies by categories entered in by izogn administrator.,1,administrator,10,"browse, administrator, movie, allow, enter, customer, shall, category, izogn, website"
287,"F:Website shall allow customers to view reviews of selected movies by other customers.
",F,Website shall allow customers to view reviews of selected movies by other customers.,0,,8,"select, review, movie, allow, view, customer, shall, website"
288,"F:Website shall allow customers to add their own movie review for a selected movie.
",F,Website shall allow customers to add their own movie review for a selected movie.,2,"movie review, movie",8,"review, add, movie, allow, customer, shall, selected, website"
289,"F:Website shall allow the Izogn administrator to approve a review posted by a customer.
",F,Website shall allow the Izogn administrator to approve a review posted by a customer.,3,"administrator, review, customer",9,"approve, review, administrator, post, allow, customer, shall, izogn, website"
290,"F:System will allow customers to pay for a streaming movie with a pre-paid card.
",F,System will allow customers to pay for a streaming movie with a pre-paid card.,3,"system, movie, card",8,"streaming, pay, movie, card, allow, system, pre-paid, customer"
291,"F: Website shall allow customers to purchase pre-paid cards of $5  $10  or $20 value either by credit card or mail-in payment option.
",F, Website shall allow customers to purchase pre-paid cards of $5  $10  or $20 value either by credit card or mail-in payment option.,3,"20 value, by credit card, payment option",16,"option, mail-in, credit, 20, either, card, allow, purchase, pre-paid, customer, shall, value, 5, payment, 10, website"
292,"F: System shall automatically update the main page of the website every Friday  and show the 4 latest movies that have been added to the website.
",F, System shall automatically update the main page of the website every Friday  and show the 4 latest movies that have been added to the website.,4,"system, page, friday, website",14,"page, friday, automatically, add, every, late, movie, 4, system, shall, show, update, main, website"
293,"F:System shall allow users to update their billing and contact information via the 'My Account' section of the website.
",F,System shall allow users to update their billing and contact information via the 'My Account' section of the website.,6,"system, billing, information, 'my account, section, website",13,"billing, contact, account, information, allow, system, shall, 'my, via, user, update, website, section"
294,"F: Pre-paid cards shall be distributed via email  or via a printed paper card.
",F, Pre-paid cards shall be distributed via email  or via a printed paper card.,2,"be distributed via email, paper card",8,"printed, card, pre-paid, shall, distribute, via, paper, email"
295,"F:Only registered customers can purchase streaming movies.
",F,Only registered customers can purchase streaming movies.,0,,5,"stream, movie, purchase, customer, registered"
296,"F: Movies can only be streamed if the customer has purchased a movie  and is within the 2-day time period to stream the movie.
",F, Movies can only be streamed if the customer has purchased a movie  and is within the 2-day time period to stream the movie.,4,"customer, movie, time period, movie",8,"stream, 2-day, movie, time, purchase, customer, period, within"
297,"F:Website must be able to support free trial periods with various parameters set by the Izogn Manager.
",F,Website must be able to support free trial periods with various parameters set by the Izogn Manager.,3,"website, trial, izogn manager",12,"able, support, set, manager, parameter, free, must, trial, period, izogn, website, various"
298,"F: All streaming movie sales will be logged in the database  and accessible by the administrator.
",F, All streaming movie sales will be logged in the database  and accessible by the administrator.,3,"movie, database, administrator",7,"accessible, streaming, administrator, movie, sale, log, database"
299,"F: All registered customer information shall be stored and maintained in the database  even after the customer cancels their account.
",F, All registered customer information shall be stored and maintained in the database  even after the customer cancels their account.,4,"registered customer information, database, customer, account",10,"account, even, information, cancel, customer, register, shall, maintain, store, database"
300,"F: Daily usage statistics should be logged  and accessible by the administrator.
",F, Daily usage statistics should be logged  and accessible by the administrator.,2,"usage, administrator",6,"accessible, statistic, administrator, usage, daily, log"
301,"F:The owner shall have free access to all of the streaming movies.
",F,The owner shall have free access to all of the streaming movies.,3,"owner, access, streaming",6,"streaming, free, movie, shall, access, owner"
302,"PE:Total lead cycle time must be completed in 5 minutes for 90% of lead volume between the business hours of 8AM CST to 8PM CST; then 3 minutes for 99% of lead volume during off business hours.
",PE,Total lead cycle time must be completed in 5 minutes for 90% of lead volume between the business hours of 8AM CST to 8PM CST; then 3 minutes for 99% of lead volume during off business hours.,9,"cycle time, 90 %, volume, business, 8am cst, 8pm cst, 99 %, volume, business",17,"lead, 8am, 99, 90, cycle, business, hour, minute, must, time, 3, cst, complete, 8pm, 5, total, volume"
303,"PE:No lead evaluation will complete in a time period longer than 25 seconds for 97% of all leads processed.
",PE,No lead evaluation will complete in a time period longer than 25 seconds for 97% of all leads processed.,3,"evaluation, time period, 97 %",10,"lead, 97, process, second, time, 25, complete, period, long, evaluation"
304,"PE:For leads that process longer than 25 seconds the system will record the event and duration
",PE,For leads that process longer than 25 seconds the system will record the event and duration,4,"process, system, event, duration",9,"lead, process, record, second, 25, system, event, duration, long"
305,"PE:The process must fit within the processing time conditions set forth by the Auto Rep Assignment process in which a lead is assigned within 3 minutes of the total life cycle.
",PE,The process must fit within the processing time conditions set forth by the Auto Rep Assignment process in which a lead is assigned within 3 minutes of the total life cycle.,7,"process, processing time, set forth, auto, assignment process, lead, life cycle",19,"auto, life, rep, forth, condition, set, must, lead, process, assignment, cycle, assign, processing, total, within, fit, minute, time, 3"
306,"O:The lead washing process will operate within the established physical web service structure.
",O,The lead washing process will operate within the established physical web service structure.,2,"washing process, web service structure",10,"lead, process, web, establish, structure, operate, washing, service, physical, within"
307,"O: The washing process must use a non binding  neutral data format  such as xml  when receiving and processing lead data.
",O, The washing process must use a non binding  neutral data format  such as xml  when receiving and processing lead data.,4,"washing process, non, as xml, receiving",12,"wash, xml, lead, process, bind, format, data, must, neutral, use, receiving, non"
308,"A:Defect reports will be available to technical units on a 24x7 basis.
",A,Defect reports will be available to technical units on a 24x7 basis.,2,"defect, 24x7 basis",7,"technical, 24x7, defect, unit, report, available, basis"
309,"MN:Washing parameters will be updated during scheduled maintenance hours.
",MN,Washing parameters will be updated during scheduled maintenance hours.,1,maintenance,6,"wash, scheduled, parameter, hour, maintenance, update"
310,"F:The vendor will verify the invalid lead.
",F,The vendor will verify the invalid lead.,2,"vendor, lead",4,"verify, lead, invalid, vendor"
311,"F:Vendor will submit a credit validation record to be applied to the enterprise billing system.
",F,Vendor will submit a credit validation record to be applied to the enterprise billing system.,3,"vendor, credit validation record, enterprise billing system",9,"billing, submit, enterprise, record, system, apply, vendor, credit, validation"
312,"F:If a lead is scored to the high range the system will supply the lead data and score to the enterprise system.
",F,If a lead is scored to the high range the system will supply the lead data and score to the enterprise system.,6,"lead, range, system, lead, score, enterprise system",8,"lead, enterprise, data, score, system, high, range, supply"
313,"F:The leads washing functionality will validate all leads received by the web service for valid data
",F,The leads washing functionality will validate all leads received by the web service for valid data,2,"washing functionality, web service",9,"lead, wash, receive, web, valid, functionality, data, service, validate"
314,"F:The leads washing functionality will insert all leads captured by the web service.
",F,The leads washing functionality will insert all leads captured by the web service.,2,"washing functionality, web service",7,"lead, wash, web, functionality, insert, capture, service"
315,"F:If the leads score falls within the high average score then it will be process by the ARA functionality.
",F,If the leads score falls within the high average score then it will be process by the ARA functionality.,2,"average score, ara functionality",9,"lead, average, process, functionality, score, fall, high, ara, within"
316,"F:If the leads score falls within the medium average then it will be set for manual verification by an Enrollment Coordinator through the eleads system.
",F,If the leads score falls within the medium average then it will be set for manual verification by an Enrollment Coordinator through the eleads system.,4,"medium average, verification, enrollment coordinator, system",13,"lead, average, set, eleads, enrollment, medium, manual, score, verification, system, coordinator, fall, within"
317,"F:If the leads score falls within the low average then it will be returned to the supplying vendor
",F,If the leads score falls within the low average then it will be returned to the supplying vendor,2,"average, supplying vendor",9,"lead, average, supplying, vendor, return, score, low, fall, within"
318,"F:The leads washing functionality will compile both contact and academic scoring information for a total score.
",F,The leads washing functionality will compile both contact and academic scoring information for a total score.,4,"washing functionality, contact, scoring information, score",10,"lead, compile, wash, scoring, functionality, score, information, academic, contact, total"
319,"F:The leads washing functionality will use the parameters supplied by corporate and schools to score part of the lead.
",F,The leads washing functionality will use the parameters supplied by corporate and schools to score part of the lead.,3,"washing functionality, score part, lead",10,"lead, wash, parameter, corporate, functionality, score, use, school, supply, part"
320,"F:The leads washing functionality will return the lead data supplied to the vendor along with the reason of rejection.
",F,The leads washing functionality will return the lead data supplied to the vendor along with the reason of rejection.,4,"washing functionality, lead, vendor, reason of rejection",10,"lead, wash, functionality, return, data, along, rejection, vendor, supply, reason"
321,"F:The leads washing functionality will have an interface in which lead data parameters can be maintained.
",F,The leads washing functionality will have an interface in which lead data parameters can be maintained.,2,"washing functionality, interface",7,"lead, wash, parameter, interface, functionality, data, maintain"
322,"F:The leads washing functionality will verify the users authentication and rights to make parameter updates.
",F,The leads washing functionality will verify the users authentication and rights to make parameter updates.,3,"washing functionality, authentication, make parameter",10,"verify, lead, wash, parameter, functionality, make, user, update, authentication, right"
323,"F:The leads washing functionality will store any potential lead duplicates returned by the enterprise system.
",F,The leads washing functionality will store any potential lead duplicates returned by the enterprise system.,3,"washing functionality, lead, enterprise system",9,"lead, wash, enterprise, potential, functionality, return, system, store, duplicate"
324,"F:Prior to submitting the lead to the enterprise system the leads washing functionality will assign the lead to an admissions rep.
",F,Prior to submitting the lead to the enterprise system the leads washing functionality will assign the lead to an admissions rep.,5,"lead, enterprise system, washing functionality, lead, rep",10,"lead, submit, enterprise, wash, assign, functionality, rep, system, prior, admission"
325,"F:The leads washing functionality shall receive a period list of available reps from the enterprise system.
",F,The leads washing functionality shall receive a period list of available reps from the enterprise system.,3,"washing functionality, period list, enterprise system",11,"lead, wash, receive, list, enterprise, functionality, rep, system, shall, period, available"
326,"LF:The product shall simulate the look of ships at sea.
",LF,The product shall simulate the look of ships at sea.,3,"product, look, at sea",6,"product, sea, shall, look, simulate, ship"
327,"LF:The product shall display the grids within a circle as a view from a periscope.
",LF,The product shall display the grids within a circle as a view from a periscope.,4,"product, circle, view, periscope",8,"periscope, product, circle, view, grid, shall, display, within"
328,"LF:The product shall display each type of ship in a grid using an image of the specific type of ship.
",LF,The product shall display each type of ship in a grid using an image of the specific type of ship.,5,"product, type of ship, grid, image, type of ship",9,"product, image, type, specific, grid, shall, use, display, ship"
329,"LF: When the offensive player takes a shot  the product shall simulate the sound of a ship at sea.
",LF, When the offensive player takes a shot  the product shall simulate the sound of a ship at sea.,5,"player, shot, product, sound, ship at sea",10,"product, offensive, take, sound, sea, player, shall, shot, simulate, ship"
330,"LF: When a shot is marked as a miss  the product shall simulate the sound of a shot missing its target.
",LF, When a shot is marked as a miss  the product shall simulate the sound of a shot missing its target.,6,"shot, miss, product, sound, shot, target",8,"miss, product, target, sound, mark, shall, shot, simulate"
331,"LF: When a shot is marked as a hit  the product shall simulate the sound of a shot hitting its target.
",LF, When a shot is marked as a hit  the product shall simulate the sound of a shot hitting its target.,6,"shot, hit, product, sound, shot, target",8,"product, target, sound, mark, hit, shall, shot, simulate"
332,"LF: When a ship is sunk  the product shall simulate the sound of a sinking ship.
",LF, When a ship is sunk  the product shall simulate the sound of a sinking ship.,4,"ship, product, sound, sinking ship",7,"sink, product, sound, shall, sinking, simulate, ship"
333,"A: The product shall be available 24 hours per day  seven days per week.
",A, The product shall be available 24 hours per day  seven days per week.,3,"product, per day, per week",9,"seven, product, day, hour, per, week, available, shall, 24"
334,"PE:The product shall able to handle a large number of games simultaneously.
",PE,The product shall able to handle a large number of games simultaneously.,2,"product, number",8,"able, game, product, simultaneously, shall, handle, large, number"
335,"PE:The response time shall be fast enough to maintain the flow of the game.  The response time shall be no more than 2 seconds for 95% of responses and no more than 4% for the remaining responses.
",PE,The response time shall be fast enough to maintain the flow of the game.  The response time shall be no more than 2 seconds for 95% of responses and no more than 4% for the remaining responses.,6,"response time, flow, game, response time, 95 %, 4 %",13,"enough, game, 2, second, remain, flow, response, time, 95, 4, shall, maintain, fast"
336,"PE:The product shall protect the identity of the players. The product shall provide players no access to information that might reveal the identity of another player.
",PE,The product shall protect the identity of the players. The product shall provide players no access to information that might reveal the identity of another player.,7,"product, identity, product, access, information, identity, player",11,"provide, might, product, protect, another, information, player, shall, access, identity, reveal"
337,"US:The product shall be intuitive and self-explanatory.  Nine out ten users shall be able to successfully complete a game with no training.
",US,The product shall be intuitive and self-explanatory.  Nine out ten users shall be able to successfully complete a game with no training.,4,"product, nine out ten, game, training",12,"able, successfully, product, game, ten, training, intuitive, nine, complete, shall, user, self-explanatory"
338,"US: The product shall be available to players who understand English  Spanish and French.  The product shall allow the user to select the language upon accessing the product.
",US, The product shall be available to players who understand English  Spanish and French.  The product shall allow the user to select the language upon accessing the product.,6,"product, spanish, product, user, language, product",14,"product, french, select, language, english, upon, spanish, allow, player, available, shall, user, access, understand"
339,"SE:The product shall provide players no access to information that might reveal the identity of another player
",SE,The product shall provide players no access to information that might reveal the identity of another player,5,"product, access, information, identity, player",10,"provide, might, product, another, information, player, shall, access, identity, reveal"
340,"PE:The response time shall be fast enough to maintain the flow of the game. The response time shall be no more than 2 seconds for 95% of responses and no more than 4% for the remaining responses.
",PE,The response time shall be fast enough to maintain the flow of the game. The response time shall be no more than 2 seconds for 95% of responses and no more than 4% for the remaining responses.,6,"response time, flow, game, response time, 95 %, 4 %",13,"enough, game, 2, second, remain, flow, response, time, 95, 4, shall, maintain, fast"
341,"F:The product shall maintain a list of players.
",F,The product shall maintain a list of players.,2,"product, list",5,"product, list, player, shall, maintain"
342,"F:The product shall allow a user to identify himself or herself as a player.
",F,The product shall allow a user to identify himself or herself as a player.,3,"product, user, player",6,"product, allow, player, shall, identify, user"
343,"F: Once a game has been initiated  the product shall make the players assigned to the game unavailable for selection from the list of players.
",F, Once a game has been initiated  the product shall make the players assigned to the game unavailable for selection from the list of players.,5,"game, product, game, for selection, list",10,"game, product, selection, list, unavailable, assign, make, player, shall, initiate"
344,"F:The product shall allow a user to remove himself or herself from the list of players at any time.
",F,The product shall allow a user to remove himself or herself from the list of players at any time.,4,"product, user, list, time",8,"product, list, time, remove, allow, player, shall, user"
345,"F:The product shall make inactive players unavailable for selection from the list of players.
",F,The product shall make inactive players unavailable for selection from the list of players.,3,"product, for selection, list",8,"product, inactive, selection, unavailable, list, make, player, shall"
346,"F:The product shall remove players who have been inactive for 24 hours from the list of players.
",F,The product shall remove players who have been inactive for 24 hours from the list of players.,2,"product, list",8,"product, inactive, list, hour, remove, player, shall, 24"
